{
    "schema_version": 1,
    "plant": {
        "frame": "bluerov2-heavy",
        "body_m": [0.58, 0.44, 0.18],
        "mass_kg": 7.5,
        "displaced_volume_m3": 0.0075,
        "center_of_buoyancy_z_m": 0.0225,
        "motor_positions_m": [
            [0.2416666667, 0.1955555556, 0],
            [0.2416666667, -0.1955555556, 0],
            [-0.2416666667, 0.1955555556, 0],
            [-0.2416666667, -0.1955555556, 0],
            [0.2416666667, 0.1955555556, 0],
            [0.2416666667, -0.1955555556, 0],
            [-0.2416666667, 0.1955555556, 0],
            [-0.2416666667, -0.1955555556, 0]
        ],
        "motor_channels": [0, 1, 2, 3, 4, 5, 6, 7]
    },
    "architecture": "pi_navigator",
    "scenario": "baseline"
}
